{
  "schema_version": "1.0",
  "stages_completed": ["inspect", "edit", "structural_verify", "visual_verify", "decide"],
  "decision": "pass",
  "layout_risk": false,
  "risk_reason": null,
  "visual_checks_executed": true,
  "pages_checked": 3,
  "missing_dependencies": [],
  "issues": [],
  "structural_checks": {
    "element_count_before": 42,
    "element_count_after": 42,
    "validation_passed": true
  },
  "input_file": "report.docx",
  "output_file": "report_edited.docx"
}
