{
  "schema_version": "1.0",
  "stages_completed": ["inspect", "edit", "structural_verify", "decide"],
  "decision": "pass",
  "layout_risk": true,
  "risk_reason": "visual_checks_unavailable",
  "visual_checks_executed": false,
  "pages_checked": 0,
  "missing_dependencies": ["pdftoppm"],
  "issues": [
    {
      "severity": "info",
      "page": null,
      "type": "other",
      "evidence": "Visual verification skipped because pdftoppm is not installed. Structural checks passed but layout correctness is unconfirmed."
    }
  ],
  "structural_checks": {
    "element_count_before": 20,
    "element_count_after": 22,
    "validation_passed": true
  },
  "input_file": "memo.docx",
  "output_file": "memo_edited.docx"
}
